{
  "schemaVersion": 1,
  "characterId": "00000000000000030000000000000003",
  "level": 10,
  "experience": 450,
  "attributes": {
    "Physique": 6,
    "Awareness": 8,
    "Vitality": 5,
    "Presence": 3,
    "Intellect": 6,
    "Reflex": 7,
    "Fortune": 3
  },
  "skills": {
    "Stealth": 70,
    "Security": 70,
    "Science": 70
  },
  "specializedSkills": [
    "Stealth",
    "Security",
    "Science"
  ],
  "backgroundId": "salvage-inspector",
  "traitIds": [
    "unassuming",
    "fine-touch"
  ],
  "perkRanks": {},
  "unspentPoints": {
    "skill": 0,
    "perk": 0,
    "attribute": 0
  }
}
