{
  "schemaVersion": 1,
  "characterId": "00000000000000060000000000000006",
  "level": 10,
  "experience": 450,
  "attributes": {
    "Physique": 6,
    "Awareness": 8,
    "Vitality": 5,
    "Presence": 3,
    "Intellect": 6,
    "Reflex": 7,
    "Fortune": 3
  },
  "skills": {
    "Influence": 70,
    "Commerce": 70,
    "Medicine": 70
  },
  "specializedSkills": [
    "Influence",
    "Commerce",
    "Medicine"
  ],
  "backgroundId": "settlement-mediator",
  "traitIds": [
    "commanding",
    "adaptable"
  ],
  "perkRanks": {},
  "unspentPoints": {
    "skill": 0,
    "perk": 0,
    "attribute": 0
  }
}
