{
  "schemaVersion": 1,
  "characterId": "00000000000000040000000000000004",
  "level": 10,
  "experience": 450,
  "attributes": {
    "Physique": 6,
    "Awareness": 8,
    "Vitality": 5,
    "Presence": 3,
    "Intellect": 6,
    "Reflex": 7,
    "Fortune": 3
  },
  "skills": {
    "Engineering": 70,
    "Science": 70,
    "Security": 70
  },
  "specializedSkills": [
    "Engineering",
    "Science",
    "Security"
  ],
  "backgroundId": "relay-technician",
  "traitIds": [
    "methodical",
    "machine-empathy"
  ],
  "perkRanks": {},
  "unspentPoints": {
    "skill": 0,
    "perk": 0,
    "attribute": 0
  }
}
